{
  "schema": "league.skill-contracts.v1",
  "roots": [
    {"label": "agents-custom"},
    {"label": "codex-custom"}
  ],
  "skills": [
    {
      "identity": "competency-unpacker",
      "scope": "shared",
      "provenance": {"classification": "unrecorded", "reason": "no-authoritative-source-record"},
      "version": {"classification": "unrecorded"},
      "capabilities": {
        "required": {"harness": [], "tool": [], "platform": [], "browser": [], "forge": [], "delegation": [], "multiplexer": []},
        "optional": {"harness": [], "tool": [], "platform": [], "browser": [], "forge": [], "delegation": [], "multiplexer": []}
      },
      "fallback": {"mode": "inline", "when_missing": [], "when_available": "declared"}
    },
    {
      "identity": "cover-letter",
      "scope": "shared",
      "provenance": {"classification": "unrecorded", "reason": "no-authoritative-source-record"},
      "version": {"classification": "unrecorded"},
      "capabilities": {
        "required": {"harness": [], "tool": [], "platform": [], "browser": [], "forge": [], "delegation": [], "multiplexer": []},
        "optional": {"harness": [], "tool": ["document-export"], "platform": [], "browser": ["web-research"], "forge": [], "delegation": [], "multiplexer": []}
      },
      "fallback": {"mode": "inline", "when_missing": ["browser.web-research", "tool.document-export"], "when_available": "declared"}
    },
    {
      "identity": "drawio-skill",
      "scope": "specialist",
      "provenance": {"classification": "recorded", "owner": "Agents365-ai/365-skills"},
      "version": {"classification": "unrecorded"},
      "capabilities": {
        "required": {"harness": [], "tool": ["drawio-cli"], "platform": [], "browser": [], "forge": [], "delegation": [], "multiplexer": []},
        "optional": {"harness": [], "tool": [], "platform": ["desktop-ui"], "browser": [], "forge": [], "delegation": [], "multiplexer": []}
      },
      "fallback": {"mode": "refuse", "when_missing": [], "when_available": "declared"}
    },
    {
      "identity": "find-skills",
      "scope": "specialist",
      "provenance": {"classification": "recorded", "owner": "vercel-labs/skills"},
      "version": {"classification": "unrecorded"},
      "capabilities": {
        "required": {"harness": [], "tool": ["skill-catalog-search"], "platform": [], "browser": [], "forge": [], "delegation": [], "multiplexer": []},
        "optional": {"harness": [], "tool": [], "platform": [], "browser": [], "forge": [], "delegation": [], "multiplexer": []}
      },
      "fallback": {"mode": "refuse", "when_missing": [], "when_available": "declared"}
    },
    {
      "identity": "frontend-design",
      "scope": "shared",
      "provenance": {"classification": "unrecorded", "reason": "no-authoritative-source-record"},
      "version": {"classification": "unrecorded"},
      "capabilities": {
        "required": {"harness": [], "tool": [], "platform": [], "browser": [], "forge": [], "delegation": [], "multiplexer": []},
        "optional": {"harness": [], "tool": ["repository-files"], "platform": [], "browser": ["visual-preview"], "forge": [], "delegation": [], "multiplexer": []}
      },
      "fallback": {"mode": "inline", "when_missing": ["browser.visual-preview", "tool.repository-files"], "when_available": "declared"}
    },
    {
      "identity": "greploop",
      "scope": "specialist",
      "provenance": {"classification": "unrecorded", "reason": "no-authoritative-source-record"},
      "version": {"classification": "unrecorded"},
      "capabilities": {
        "required": {"harness": [], "tool": ["greptile-review"], "platform": [], "browser": [], "forge": ["hosted-code-review"], "delegation": [], "multiplexer": []},
        "optional": {"harness": [], "tool": [], "platform": [], "browser": [], "forge": [], "delegation": [], "multiplexer": []}
      },
      "fallback": {"mode": "refuse", "when_missing": [], "when_available": "declared"}
    },
    {
      "identity": "grill-me",
      "scope": "shared",
      "provenance": {"classification": "recorded", "owner": "mattpocock/skills"},
      "version": {"classification": "unrecorded"},
      "capabilities": {
        "required": {"harness": [], "tool": [], "platform": [], "browser": [], "forge": [], "delegation": [], "multiplexer": []},
        "optional": {"harness": [], "tool": [], "platform": [], "browser": [], "forge": [], "delegation": [], "multiplexer": []}
      },
      "fallback": {"mode": "inline", "when_missing": [], "when_available": "declared"}
    },
    {
      "identity": "grill-with-docs",
      "scope": "shared",
      "provenance": {"classification": "recorded", "owner": "mattpocock/skills"},
      "version": {"classification": "unrecorded"},
      "capabilities": {
        "required": {"harness": [], "tool": [], "platform": [], "browser": [], "forge": [], "delegation": [], "multiplexer": []},
        "optional": {"harness": [], "tool": ["repository-files"], "platform": [], "browser": [], "forge": [], "delegation": [], "multiplexer": []}
      },
      "fallback": {"mode": "inline", "when_missing": ["tool.repository-files"], "when_available": "declared"}
    },
    {
      "identity": "handoff",
      "scope": "shared",
      "provenance": {"classification": "recorded", "owner": "mattpocock/skills"},
      "version": {"classification": "unrecorded"},
      "capabilities": {
        "required": {"harness": [], "tool": [], "platform": [], "browser": [], "forge": [], "delegation": [], "multiplexer": []},
        "optional": {"harness": [], "tool": [], "platform": [], "browser": [], "forge": [], "delegation": [], "multiplexer": []}
      },
      "fallback": {"mode": "inline", "when_missing": [], "when_available": "declared"}
    },
    {
      "identity": "herdr",
      "scope": "specialist",
      "provenance": {"classification": "unrecorded", "reason": "no-authoritative-source-record"},
      "version": {"classification": "unrecorded"},
      "capabilities": {
        "required": {"harness": [], "tool": [], "platform": [], "browser": [], "forge": [], "delegation": [], "multiplexer": ["herdr"]},
        "optional": {"harness": [], "tool": [], "platform": [], "browser": [], "forge": [], "delegation": [], "multiplexer": []}
      },
      "fallback": {"mode": "refuse", "when_missing": [], "when_available": "declared"}
    },
    {
      "identity": "improve-codebase-architecture",
      "scope": "specialist",
      "provenance": {"classification": "recorded", "owner": "mattpocock/skills"},
      "version": {"classification": "unrecorded"},
      "capabilities": {
        "required": {"harness": [], "tool": ["repository-files"], "platform": [], "browser": [], "forge": [], "delegation": [], "multiplexer": []},
        "optional": {"harness": [], "tool": [], "platform": [], "browser": [], "forge": ["issue-tracker"], "delegation": [], "multiplexer": []}
      },
      "fallback": {"mode": "refuse", "when_missing": [], "when_available": "declared"}
    },
    {
      "identity": "lavish-transcript",
      "scope": "specialist",
      "provenance": {"classification": "unrecorded", "reason": "no-authoritative-source-record"},
      "version": {"classification": "unrecorded"},
      "capabilities": {
        "required": {"harness": ["local-transcript-log"], "tool": ["lavish-renderer"], "platform": [], "browser": [], "forge": [], "delegation": [], "multiplexer": []},
        "optional": {"harness": [], "tool": [], "platform": [], "browser": ["visual-review"], "forge": [], "delegation": [], "multiplexer": []}
      },
      "fallback": {"mode": "refuse", "when_missing": [], "when_available": "declared"}
    },
    {
      "identity": "no-mistakes",
      "scope": "specialist",
      "provenance": {"classification": "unrecorded", "reason": "no-authoritative-source-record"},
      "version": {"classification": "unrecorded"},
      "capabilities": {
        "required": {"harness": [], "tool": ["version-control"], "platform": [], "browser": [], "forge": ["code-review"], "delegation": [], "multiplexer": []},
        "optional": {"harness": [], "tool": [], "platform": [], "browser": [], "forge": [], "delegation": ["background-visible-agents"], "multiplexer": []}
      },
      "fallback": {"mode": "refuse", "when_missing": [], "when_available": "declared"}
    },
    {
      "identity": "postmortem-writing",
      "scope": "shared",
      "provenance": {"classification": "unrecorded", "reason": "no-authoritative-source-record"},
      "version": {"classification": "unrecorded"},
      "capabilities": {
        "required": {"harness": [], "tool": [], "platform": [], "browser": [], "forge": [], "delegation": [], "multiplexer": []},
        "optional": {"harness": [], "tool": [], "platform": [], "browser": [], "forge": [], "delegation": [], "multiplexer": []}
      },
      "fallback": {"mode": "inline", "when_missing": [], "when_available": "declared"}
    },
    {
      "identity": "research",
      "scope": "shared",
      "provenance": {"classification": "unrecorded", "reason": "no-authoritative-source-record"},
      "version": {"classification": "unrecorded"},
      "capabilities": {
        "required": {"harness": [], "tool": [], "platform": [], "browser": [], "forge": [], "delegation": [], "multiplexer": []},
        "optional": {"harness": [], "tool": ["web-search"], "platform": [], "browser": [], "forge": [], "delegation": ["background-visible-agents"], "multiplexer": []}
      },
      "fallback": {"mode": "inline", "when_missing": ["delegation.background-visible-agents"], "when_available": "delegate"}
    },
    {
      "identity": "run-interview-practice",
      "scope": "shared",
      "provenance": {"classification": "unrecorded", "reason": "no-authoritative-source-record"},
      "version": {"classification": "unrecorded"},
      "capabilities": {
        "required": {"harness": [], "tool": [], "platform": [], "browser": [], "forge": [], "delegation": [], "multiplexer": []},